[
  {
    "id": "frame",
    "name": "Frame",
    "category": "Composition",
    "priorityGroup": "Foundation",
    "priorityScore": 100,
    "shortDefinition": "The visible image boundary and everything placed inside it.",
    "whyItMatters": "The frame decides what the viewer notices and what stays hidden.",
    "whenToUse": [
      "Every shot",
      "Composition checks",
      "Story focus"
    ],
    "humanShootHint": "Check the edges before recording and remove anything that weakens the idea.",
    "aiPromptTemplate": "cinematic frame of [subject], intentional composition, clean edges, natural light, [duration]",
    "previewPrompt3s": "clean cinematic frame of [subject], one clear subject, stable composition, 3 seconds",
    "previewPrompt5s": "clean cinematic frame of [subject], subject enters balanced composition, stable camera, 5 seconds",
    "previewVideoUrl": null,
    "relatedTerms": [
      "Shot",
      "Rule of Thirds",
      "Negative Space"
    ],
    "commonMistakes": [
      "Leaving distracting edges",
      "Cutting off key action"
    ],
    "difficulty": "Beginner",
    "tags": [
      "composition",
      "basics",
      "framing"
    ],
    "review": {
      "status": "approved"
    },
    "assets": [
      {
        "type": "image",
        "url": "/images/terms/frame.jpg",
        "rights": {
          "licence": "CC BY 4.0",
          "holder": "aiscreens",
          "source": "Generated for aiscreens terminology education",
          "iOwnOrLicensed": true,
          "subjectsConsented": true,
          "noPII": true
        }
      }
    ]
  },
  {
    "id": "shot",
    "name": "Shot",
    "category": "Shots",
    "priorityGroup": "Foundation",
    "priorityScore": 99,
    "shortDefinition": "One continuous camera view used as a building block of a video.",
    "whyItMatters": "Shots are the smallest practical units you plan, shoot, generate, and edit.",
    "whenToUse": [
      "Shot lists",
      "Prompt planning",
      "Editing"
    ],
    "humanShootHint": "Give each shot one clear subject and one main action.",
    "aiPromptTemplate": "cinematic shot of [subject], one clear action, natural light, [duration]",
    "previewPrompt3s": "single cinematic shot of [subject], one action, stable camera, 3 seconds",
    "previewPrompt5s": "single cinematic shot of [subject], simple action with a clean hold, 5 seconds",
    "previewVideoUrl": null,
    "relatedTerms": [
      "Scene",
      "Sequence",
      "Cut"
    ],
    "commonMistakes": [
      "Trying to show too many ideas",
      "Changing angle mid-prompt without purpose"
    ],
    "difficulty": "Beginner",
    "tags": [
      "planning",
      "basics",
      "editing"
    ],
    "review": {
      "status": "approved"
    },
    "assets": [
      {
        "type": "image",
        "url": "/images/terms/shot.jpg",
        "rights": {
          "licence": "CC BY 4.0",
          "holder": "aiscreens",
          "source": "Generated for aiscreens terminology education",
          "iOwnOrLicensed": true,
          "subjectsConsented": true,
          "noPII": true
        }
      }
    ]
  },
  {
    "id": "scene",
    "name": "Scene",
    "category": "Editing",
    "priorityGroup": "Foundation",
    "priorityScore": 98,
    "shortDefinition": "A story moment that usually happens in one place and time.",
    "whyItMatters": "Scenes help you group shots around a clear dramatic or informational purpose.",
    "whenToUse": [
      "Narrative scenes",
      "Tutorial chapters",
      "Prompt packs"
    ],
    "humanShootHint": "Decide the scene goal before choosing close-ups or details.",
    "aiPromptTemplate": "cinematic scene of [subject], clear location, one story beat, [duration]",
    "previewPrompt3s": "short cinematic scene of [subject], one clear beat, 3 seconds",
    "previewPrompt5s": "short cinematic scene of [subject], location then action then hold, 5 seconds",
    "previewVideoUrl": null,
    "relatedTerms": [
      "Shot",
      "Sequence",
      "Master Shot"
    ],
    "commonMistakes": [
      "Mixing unrelated story beats",
      "Skipping the scene anchor"
    ],
    "difficulty": "Beginner",
    "tags": [
      "story",
      "structure",
      "editing"
    ],
    "review": {
      "status": "approved"
    },
    "assets": [
      {
        "type": "image",
        "url": "/images/terms/scene.jpg",
        "rights": {
          "licence": "CC BY 4.0",
          "holder": "aiscreens",
          "source": "Generated for aiscreens terminology education",
          "iOwnOrLicensed": true,
          "subjectsConsented": true,
          "noPII": true
        }
      }
    ]
  },
  {
    "id": "sequence",
    "name": "Sequence",
    "category": "Editing",
    "priorityGroup": "Foundation",
    "priorityScore": 97,
    "shortDefinition": "A planned order of shots that creates a complete mini-story.",
    "whyItMatters": "A sequence turns separate clips into something viewers can follow.",
    "whenToUse": [
      "Reels",
      "Montages",
      "Tutorials",
      "Story scenes"
    ],
    "humanShootHint": "Plan context, action, detail, emotion, and support before filming.",
    "aiPromptTemplate": "cinematic sequence for [subject], ordered shots, clear visual progression, [duration]",
    "previewPrompt3s": "three-beat micro sequence of [subject], context detail payoff, 3 seconds",
    "previewPrompt5s": "five-second micro sequence of [subject], context action detail emotional hold, 5 seconds",
    "previewVideoUrl": null,
    "relatedTerms": [
      "Shot",
      "Cut",
      "B-Roll"
    ],
    "commonMistakes": [
      "Collecting random clips",
      "No clear beginning or payoff"
    ],
    "difficulty": "Beginner",
    "tags": [
      "planning",
      "story",
      "shot list"
    ],
    "review": {
      "status": "approved"
    },
    "assets": [
      {
        "type": "image",
        "url": "/images/terms/sequence.jpg",
        "rights": {
          "licence": "CC BY 4.0",
          "holder": "aiscreens",
          "source": "Generated for aiscreens terminology education",
          "iOwnOrLicensed": true,
          "subjectsConsented": true,
          "noPII": true
        }
      }
    ]
  },
  {
    "id": "aspect-ratio",
    "name": "Aspect Ratio",
    "category": "Composition",
    "priorityGroup": "Foundation",
    "priorityScore": 96,
    "shortDefinition": "The shape of the frame, such as vertical 9:16 or widescreen 16:9.",
    "whyItMatters": "The frame shape changes composition, platform fit, and where attention sits.",
    "whenToUse": [
      "Social video",
      "YouTube",
      "Cinema look",
      "Storyboards"
    ],
    "humanShootHint": "Choose the delivery format first, then compose for that shape.",
    "aiPromptTemplate": "cinematic [subject], composed for chosen aspect ratio, clean negative space, [duration]",
    "previewPrompt3s": "cinematic [subject] composed for vertical and widescreen-safe framing, 3 seconds",
    "previewPrompt5s": "cinematic [subject], subject moves through a balanced frame shape, 5 seconds",
    "previewVideoUrl": null,
    "relatedTerms": [
      "Frame",
      "Negative Space",
      "Rule of Thirds"
    ],
    "commonMistakes": [
      "Cropping important action",
      "Using one composition for every platform"
    ],
    "difficulty": "Beginner",
    "tags": [
      "format",
      "composition",
      "platform"
    ],
    "review": {
      "status": "approved"
    },
    "assets": [
      {
        "type": "image",
        "url": "/images/terms/aspect-ratio.jpg",
        "rights": {
          "licence": "CC BY 4.0",
          "holder": "aiscreens",
          "source": "Generated for aiscreens terminology education",
          "iOwnOrLicensed": true,
          "subjectsConsented": true,
          "noPII": true
        }
      }
    ]
  },
  {
    "id": "establishing-shot",
    "name": "Establishing Shot",
    "category": "Shots",
    "priorityGroup": "Foundation",
    "priorityScore": 95,
    "shortDefinition": "A wider shot that shows where the story happens.",
    "whyItMatters": "It gives the viewer location, mood, scale, and context before details arrive.",
    "whenToUse": [
      "Opening a scene",
      "Travel",
      "Lifestyle",
      "Narrative context"
    ],
    "humanShootHint": "Step back, keep the horizon clean, and let the place read before action begins.",
    "aiPromptTemplate": "wide establishing shot of [subject], clear location, cinematic natural light, [duration]",
    "previewPrompt3s": "wide establishing shot of [subject], static camera, soft natural light, 3 seconds",
    "previewPrompt5s": "wide establishing shot of [subject], gentle hold as one small action begins, 5 seconds",
    "previewVideoUrl": null,
    "relatedTerms": [
      "Wide Shot",
      "Master Shot",
      "Scene"
    ],
    "commonMistakes": [
      "Starting too tight",
      "Showing a location with no story relevance"
    ],
    "difficulty": "Beginner",
    "tags": [
      "location",
      "opening",
      "context",
      "AI prompt"
    ],
    "review": {
      "status": "approved"
    },
    "localisation": {
      "es": {
        "name": "Plano de situación",
        "shortDefinition": "Un plano amplio que muestra dónde ocurre la historia.",
        "whyItMatters": "Da al espectador ubicación, ambiente, escala y contexto antes de que lleguen los detalles."
      },
      "hi": {
        "name": "स्थापना शॉट",
        "shortDefinition": "एक चौड़ा शॉट जो दिखाता है कि कहानी कहाँ हो रही है।",
        "whyItMatters": "विवरण आने से पहले दर्शक को स्थान, माहौल, पैमाना और संदर्भ देता है।"
      }
    },
    "assets": []
  },
  {
    "id": "wide-shot",
    "name": "Wide Shot",
    "category": "Shots",
    "priorityGroup": "Foundation",
    "priorityScore": 94,
    "shortDefinition": "Frames the subject with plenty of surrounding environment.",
    "whyItMatters": "It shows body language, space, and how the subject relates to the world.",